{
  "domain": "governance",
  "id": "gov-verify-001",
  "scope": "canon",
  "created_epoch": 1700000000,
  "required_witnesses": 3,
  "witness_count": 3,
  "text": "The board considered the proposal carefully. Concerns regarding scope creep, overlap with existing GNWTC programs, and equity participation by Catoosa, Walker, Dade, and Chattooga counties were recorded. The decision proceeds within stated red and floor constraints.",
  "DECISION_PACKET": {
    "title": "Approve Hutcheson workforce-development RFP (trades focus)",
    "scope": "canon",
    "red_items": [
      "no coercion of trainees or employees",
      "no exploitation of public funds for private gain",
      "no deception in financial reporting to member counties"
    ],
    "floor_items": [
      "budget within board-approved tolerance",
      "covenant ground-lease structure preserved",
      "scope confined to trades programs aligned with regional employer demand"
    ],
    "way_path": "Issue RFP through the GNWTC partnership; scope limited to trades education programs aligned with documented regional employer demand. Equity participation pro-rata across the four member counties; outcomes reported quarterly through the Setup/Positioning/Conversion phase reporting structure.",
    "execution_steps": [
      "Draft RFP",
      "Board review and amendment cycle",
      "Issue RFP",
      "Evaluate responses against scoring rubric",
      "Award and contract execution",
      "Quarterly outcome reporting"
    ],
    "witnesses": [
      "JDA Board Chair",
      "GNWTC President",
      "County Commissioner Catoosa"
    ],
    "wait_window_seconds": 604800,
    "scripture_anchors": ["Prov 22:16", "Mic 6:8", "Lev 25:36"]
  }
}
